{
  "$schema": "https://json-schema.org/draft/2020-12/schema",
  "title": "UpdateExecutionStepReport",
  "type": "object",
  "additionalProperties": false,
  "required": [
    "phase",
    "step_id",
    "step_name",
    "status",
    "summary",
    "commands_run",
    "files_created",
    "files_modified",
    "validation_checks",
    "artifacts",
    "blockers",
    "next_actions"
  ],
  "properties": {
    "phase": {
      "type": "string",
      "enum": [
        "execution_step"
      ]
    },
    "step_id": {
      "type": "integer",
      "minimum": 0,
      "maximum": 10
    },
    "step_name": {
      "type": "string",
      "minLength": 1
    },
    "status": {
      "type": "string",
      "enum": [
        "complete",
        "partial",
        "blocked"
      ]
    },
    "summary": {
      "type": "string",
      "minLength": 1
    },
    "commands_run": {
      "type": "array",
      "items": {
        "type": "string"
      }
    },
    "files_created": {
      "type": "array",
      "items": {
        "type": "string"
      }
    },
    "files_modified": {
      "type": "array",
      "items": {
        "type": "string"
      }
    },
    "validation_checks": {
      "type": "array",
      "items": {
        "type": "object",
        "additionalProperties": false,
        "required": [
          "name",
          "status",
          "details"
        ],
        "properties": {
          "name": {
            "type": "string"
          },
          "status": {
            "type": "string",
            "enum": [
              "pass",
              "fail",
              "not_run"
            ]
          },
          "details": {
            "type": "string"
          }
        }
      }
    },
    "artifacts": {
      "type": "array",
      "items": {
        "type": "string"
      }
    },
    "blockers": {
      "type": "array",
      "items": {
        "type": "string"
      }
    },
    "next_actions": {
      "type": "array",
      "items": {
        "type": "string"
      }
    }
  }
}
