{"phase":"execution_step","step_id":2,"step_name":"refresh_blockscout","status":"complete","summary":"Executed Playbook Step 2 only. Refreshed all 9 required Blockscout snapshot artifacts into data/snapshots/external_review/2026-03-04-independent-rerun4 using paginated (`items` + `next_page_params`) and single-endpoint fetches, then validated existence, JSON parseability, and expected payload shape.","commands_run":["cd '/Users/aeziz-local/Side Projects/$sumr-token-value-accrual-analysis' && pwd && ls -la && env | rg '^SNAPSHOT_DIR=' || true","cd '/Users/aeziz-local/Side Projects/$sumr-token-value-accrual-analysis' && export SNAPSHOT_DIR='data/snapshots/external_review/2026-03-04-independent-rerun4' && python - <<'PY' ...playbook Step 2 Blockscout refresh script... PY","cd '/Users/aeziz-local/Side Projects/$sumr-token-value-accrual-analysis' && python - <<'PY' ...validate 9 targets exist, parse JSON, enforce `items` list for paginated outputs, print sha256/bytes... PY","cd '/Users/aeziz-local/Side Projects/$sumr-token-value-accrual-analysis' && ls -l 'data/snapshots/external_review/2026-03-04-independent-rerun4' | rg 'base_blockscout|eth_blockscout|arb_blockscout'"],"files_created":[],"files_modified":["/Users/aeziz-local/Side Projects/$sumr-token-value-accrual-analysis/data/snapshots/external_review/2026-03-04-independent-rerun4/base_blockscout_treasury_token_transfers_all.json","/Users/aeziz-local/Side Projects/$sumr-token-value-accrual-analysis/data/snapshots/external_review/2026-03-04-independent-rerun4/eth_blockscout_treasury_token_transfers_all.json","/Users/aeziz-local/Side Projects/$sumr-token-value-accrual-analysis/data/snapshots/external_review/2026-03-04-independent-rerun4/base_blockscout_foundation_tipstream_token_transfers_all.json","/Users/aeziz-local/Side Projects/$sumr-token-value-accrual-analysis/data/snapshots/external_review/2026-03-04-independent-rerun4/base_blockscout_tipjar_txs_all.json","/Users/aeziz-local/Side Projects/$sumr-token-value-accrual-analysis/data/snapshots/external_review/2026-03-04-independent-rerun4/arb_blockscout_tipjar_txs_all.json","/Users/aeziz-local/Side Projects/$sumr-token-value-accrual-analysis/data/snapshots/external_review/2026-03-04-independent-rerun4/eth_blockscout_tipjar_txs_all.json","/Users/aeziz-local/Side Projects/$sumr-token-value-accrual-analysis/data/snapshots/external_review/2026-03-04-independent-rerun4/base_blockscout_grm_rewardAdded_all.json","/Users/aeziz-local/Side Projects/$sumr-token-value-accrual-analysis/data/snapshots/external_review/2026-03-04-independent-rerun4/base_blockscout_stsumr_contract.json","/Users/aeziz-local/Side Projects/$sumr-token-value-accrual-analysis/data/snapshots/external_review/2026-03-04-independent-rerun4/base_blockscout_summerstaking_contract.json"],"validation_checks":[{"name":"step2_refresh_execution","status":"pass","details":"Refresh script exited 0 and printed `wrote ...` for all 9 required targets."},{"name":"json_structure_and_presence","status":"pass","details":"ALL_TARGETS_PRESENT_AND_VALID=1. Paginated item counts: base treasury 712, eth treasury 95, foundation tipstream 199, base tipjar 14, arb tipjar 12, eth tipjar 12, GRM RewardAdded logs 4. Single contract snapshots parsed with expected metadata keys."},{"name":"artifact_write_timestamps","status":"pass","details":"All 9 files show current run write time (Mar 4 15:40 local) under assigned RUN_TAG snapshot directory."}],"artifacts":["/Users/aeziz-local/Side Projects/$sumr-token-value-accrual-analysis/data/snapshots/external_review/2026-03-04-independent-rerun4/base_blockscout_treasury_token_transfers_all.json","/Users/aeziz-local/Side Projects/$sumr-token-value-accrual-analysis/data/snapshots/external_review/2026-03-04-independent-rerun4/eth_blockscout_treasury_token_transfers_all.json","/Users/aeziz-local/Side Projects/$sumr-token-value-accrual-analysis/data/snapshots/external_review/2026-03-04-independent-rerun4/base_blockscout_foundation_tipstream_token_transfers_all.json","/Users/aeziz-local/Side Projects/$sumr-token-value-accrual-analysis/data/snapshots/external_review/2026-03-04-independent-rerun4/base_blockscout_tipjar_txs_all.json","/Users/aeziz-local/Side Projects/$sumr-token-value-accrual-analysis/data/snapshots/external_review/2026-03-04-independent-rerun4/arb_blockscout_tipjar_txs_all.json","/Users/aeziz-local/Side Projects/$sumr-token-value-accrual-analysis/data/snapshots/external_review/2026-03-04-independent-rerun4/eth_blockscout_tipjar_txs_all.json","/Users/aeziz-local/Side Projects/$sumr-token-value-accrual-analysis/data/snapshots/external_review/2026-03-04-independent-rerun4/base_blockscout_grm_rewardAdded_all.json","/Users/aeziz-local/Side Projects/$sumr-token-value-accrual-analysis/data/snapshots/external_review/2026-03-04-independent-rerun4/base_blockscout_stsumr_contract.json","/Users/aeziz-local/Side Projects/$sumr-token-value-accrual-analysis/data/snapshots/external_review/2026-03-04-independent-rerun4/base_blockscout_summerstaking_contract.json"],"blockers":[],"next_actions":["remaining_items: none for Step 2 scope.","Await assignment for next numbered step (do not execute automatically per execution boundaries)."]}