{"phase":"execution_step","step_id":6,"step_name":"build_evidence_and_v2","status":"complete","summary":"Step 6 executed successfully for run tag `2026-03-04-independent-rerun4`: `make evidence` generated deterministic evidence artifacts in `results/proofs/evidence_2026-03-04-independent-rerun4`, and `make v2_workflow` generated/updated v2 outputs in `results/tables` and `results/charts`. Integrity check outcome: strict-gated v2 outputs are `BLOCKED_NO_GATE_PASSED_CYCLES`, while bounded bands are `READY_SUPPLEMENTAL_BOUNDED`.","commands_run":["make evidence EVIDENCE_SNAPSHOT_DIR='data/snapshots/external_review/2026-03-04-independent-rerun4' EVIDENCE_OUTPUT_DIR='results/proofs/evidence_2026-03-04-independent-rerun4'","make v2_workflow V2_EVIDENCE_DIR='results/proofs/evidence_2026-03-04-independent-rerun4' V2_TABLES_DIR='results/tables' V2_CHARTS_DIR='results/charts'","find 'results/proofs/evidence_2026-03-04-independent-rerun4' -maxdepth 1 -type f | sort","find 'results/tables' -type f -mmin -30 | sort","find 'results/charts' -type f -mmin -30 | sort","python - <<'PY'\nimport json\nfrom pathlib import Path\n\ne = Path('results/proofs/evidence_2026-03-04-independent-rerun4')\nrequired_evidence = [\n    'kpi_summary.json',\n    'payout_attribution_summary.json',\n    'staker_revenue_canonical_summary.json',\n    'source_of_funds_summary.json',\n    'emissions_vs_revenue_decomposition.json',\n    'discrepancy_tickets.json',\n]\nmissing_evidence = [f for f in required_evidence if not (e / f).exists()]\n\nrequired_v2_tables = [\n    'results/tables/v2_workflow_summary.json',\n    'results/tables/v2_gate_passed_kpis.json',\n    'results/tables/v2_gate_validated_scenarios.json',\n    'results/tables/v2_bounded_decision_bands.json',\n]\nmissing_v2_tables = [p for p in required_v2_tables if not Path(p).exists()]\n\nrequired_v2_charts = [\n    'results/charts/v2_gate_passed_revenue_components.png',\n    'results/charts/v2_gate_passed_claim_efficiency.png',\n    'results/charts/v2_bounded_decision_bands.png',\n]\nmissing_v2_charts = [p for p in required_v2_charts if not Path(p).exists()]\n\nsummary_path = Path('results/tables/v2_workflow_summary.json')\nsummary = json.loads(summary_path.read_text()) if summary_path.exists() else {}\n\nprint('missing_evidence:', missing_evidence)\nprint('missing_v2_tables:', missing_v2_tables)\nprint('missing_v2_charts:', missing_v2_charts)\nprint('v2_summary_keys:', sorted(summary.keys()))\nfor key in ['strict_gate_passed','strict_gate_status','status','validated_scenarios_count','generated_at_utc','evidence_dir']:\n    if key in summary:\n        print(f'{key}:', summary[key])\nPY","python - <<'PY'\nimport json\nfrom pathlib import Path\np = Path('results/tables/v2_workflow_summary.json')\ns = json.loads(p.read_text())\nprint('generated_utc:', s.get('generated_utc'))\nprint('tables_dir:', s.get('tables_dir'))\nprint('charts_dir:', s.get('charts_dir'))\nprint('evidence_dir:', s.get('evidence_dir'))\nprint('gate_kpis_status:', s.get('gate_kpis_status'))\nprint('scenario_status:', s.get('scenario_status'))\nprint('bounded_band_status:', s.get('bounded_band_status'))\nPY","git status --short -- 'results/proofs/evidence_2026-03-04-independent-rerun4' 'results/tables' 'results/charts'","python - <<'PY'\nimport json\nfrom pathlib import Path\nfor p in [\n    'results/tables/v2_gate_passed_kpis.json',\n    'results/tables/v2_gate_validated_scenarios.json',\n    'results/tables/v2_bounded_decision_bands.json',\n]:\n    data = json.loads(Path(p).read_text())\n    print('---', p)\n    if isinstance(data, dict):\n        for k in ['status','generated_utc','evidence_dir','records','rows','count','note','strict_gate_status']:\n            if k in data:\n                print(f'{k}:', data[k] if k not in ('records','rows') else f'len={len(data[k])}')\n        for key in ['gate_passed_cycle_count','validated_scenario_count','band_count']:\n            if key in data:\n                print(f'{key}:', data[key])\nPY","printf 'evidence_file_count='; find 'results/proofs/evidence_2026-03-04-independent-rerun4' -maxdepth 1 -type f | wc -l; printf 'v2_table_file_count='; ls -1 'results/tables'/v2_* | wc -l; printf 'v2_chart_file_count='; ls -1 'results/charts'/v2_* | wc -l"],"files_created":["results/proofs/evidence_2026-03-04-independent-rerun4/README.md","results/proofs/evidence_2026-03-04-independent-rerun4/kpi_summary.json","results/proofs/evidence_2026-03-04-independent-rerun4/payout_attribution_summary.json","results/proofs/evidence_2026-03-04-independent-rerun4/staker_revenue_canonical_summary.json","results/proofs/evidence_2026-03-04-independent-rerun4/source_of_funds_summary.json","results/proofs/evidence_2026-03-04-independent-rerun4/emissions_vs_revenue_decomposition.json","results/proofs/evidence_2026-03-04-independent-rerun4/discrepancy_tickets.json","results/proofs/evidence_2026-03-04-independent-rerun4/defillama_context_summary.json","results/proofs/evidence_2026-03-04-independent-rerun4/contract_source_checks.json","results/proofs/evidence_2026-03-04-independent-rerun4/sumr_supply_snapshot.json","results/proofs/evidence_2026-03-04-independent-rerun4/treasury_flow_summary.json","results/proofs/evidence_2026-03-04-independent-rerun4/treasury_outflow_summary.json","results/proofs/evidence_2026-03-04-independent-rerun4/payout_attribution_gate.json","results/proofs/evidence_2026-03-04-independent-rerun4/ticket_closure_workflow.json","results/proofs/evidence_2026-03-04-independent-rerun4/tipjar_method_counts_combined.json"],"files_modified":["results/tables/v2_workflow_summary.json","results/tables/v2_gate_passed_kpis.json","results/tables/v2_gate_passed_kpis.md","results/tables/v2_gate_passed_cycles.csv","results/tables/v2_gate_validated_scenarios.json","results/tables/v2_gate_validated_scenarios.md","results/tables/v2_gate_validated_scenarios.csv","results/tables/v2_bounded_decision_bands.json","results/tables/v2_bounded_decision_bands.md","results/tables/v2_bounded_decision_bands.csv","results/charts/v2_gate_passed_revenue_components.png","results/charts/v2_gate_passed_claim_efficiency.png","results/charts/v2_bounded_decision_bands.png"],"validation_checks":[{"name":"Step 6 command: make evidence","status":"pass","details":"Exited 0 and reported: Wrote evidence artifacts to results/proofs/evidence_2026-03-04-independent-rerun4."},{"name":"Step 6 command: make v2_workflow","status":"pass","details":"Exited 0 and reported: Wrote v2 workflow outputs to results/tables and results/charts."},{"name":"Evidence core artifact presence","status":"pass","details":"All required evidence core files present in results/proofs/evidence_2026-03-04-independent-rerun4 (missing_evidence=[])."},{"name":"v2 output presence","status":"pass","details":"Required v2 tables/charts exist (missing_v2_tables=[], missing_v2_charts=[])."},{"name":"v2 workflow path consistency","status":"pass","details":"results/tables/v2_workflow_summary.json points to evidence_dir=results/proofs/evidence_2026-03-04-independent-rerun4, tables_dir=results/tables, charts_dir=results/charts."},{"name":"v2 status integrity (strict vs bounded)","status":"pass","details":"Observed gate_kpis_status=BLOCKED_NO_GATE_PASSED_CYCLES, scenario_status=BLOCKED_NO_GATE_PASSED_CYCLES, bounded_band_status=READY_SUPPLEMENTAL_BOUNDED; status separation preserved."}],"artifacts":["results/proofs/evidence_2026-03-04-independent-rerun4","results/proofs/evidence_2026-03-04-independent-rerun4/kpi_summary.json","results/proofs/evidence_2026-03-04-independent-rerun4/payout_attribution_summary.json","results/proofs/evidence_2026-03-04-independent-rerun4/staker_revenue_canonical_summary.json","results/proofs/evidence_2026-03-04-independent-rerun4/source_of_funds_summary.json","results/proofs/evidence_2026-03-04-independent-rerun4/emissions_vs_revenue_decomposition.json","results/proofs/evidence_2026-03-04-independent-rerun4/discrepancy_tickets.json","results/tables/v2_workflow_summary.json","results/tables/v2_gate_passed_kpis.json","results/tables/v2_gate_validated_scenarios.json","results/tables/v2_bounded_decision_bands.json","results/charts/v2_gate_passed_revenue_components.png","results/charts/v2_gate_passed_claim_efficiency.png","results/charts/v2_bounded_decision_bands.png"],"blockers":["Strict-gated v2 outputs are blocked by data state: `results/tables/v2_gate_passed_kpis.json` and `results/tables/v2_gate_validated_scenarios.json` both report `status=BLOCKED_NO_GATE_PASSED_CYCLES`."],"next_actions":["For downstream steps/publication, keep strict outputs explicitly non-validated per integrity rule #6 (do not present strict scenario validation as passed).","Continue with the next assigned playbook step only (Step 7 or orchestrator-directed step), using this run's evidence directory `results/proofs/evidence_2026-03-04-independent-rerun4`."]}