{"phase":"execution_step","step_id":8,"step_name":"freeze_and_monitor","status":"complete","summary":"Executed Step 8 in repo root only: baseline freeze completed and monitoring snapshot append completed for run_tag `2026-03-04-independent-rerun4`. Monitoring latest now binds to the assigned snapshot/evidence directories with preserved timestamp/hash provenance.","commands_run":["make freeze_baseline","python -m src.analysis.monitor_cycle --snapshot-dir 'data/snapshots/external_review/2026-03-04-independent-rerun4' --evidence-dir 'results/proofs/evidence_2026-03-04-independent-rerun4' --tables-dir 'results/tables'","python - <<'PY'\nimport json\nfrom pathlib import Path\np = Path('results/tables/monitoring_latest.json')\nm = json.loads(p.read_text())\nprint('snapshot_dir:', m.get('snapshot_dir'))\nprint('evidence_dir:', m.get('evidence_dir'))\nprint('observed_utc:', m.get('latest', {}).get('observed_utc'))\nprint('open_high_ticket_count:', m.get('latest', {}).get('open_high_ticket_count'))\nPY","python - <<'PY'\nimport json\nfrom pathlib import Path\nb = json.loads(Path('results/tables/baseline_manifest_latest.json').read_text())\nm = json.loads(Path('results/tables/monitoring_latest.json').read_text())\nprint('baseline_generated_utc:', b.get('generated_utc'))\nprint('baseline_tree_sha256:', (b.get('fingerprints') or {}).get('tree_sha256'))\nprint('monitor_baseline_generated_utc:', m.get('latest', {}).get('baseline_manifest_generated_utc'))\nprint('monitor_baseline_tree_sha256:', m.get('latest', {}).get('baseline_manifest_tree_sha256'))\nPY","head -n 2 'results/tables/monitoring_cycles.csv' && tail -n 2 'results/tables/monitoring_cycles.csv'"],"files_created":["/Users/aeziz-local/Side Projects/$sumr-token-value-accrual-analysis/results/tables/baseline_manifest_20260304T210420Z.json"],"files_modified":["/Users/aeziz-local/Side Projects/$sumr-token-value-accrual-analysis/results/tables/baseline_manifest_latest.json","/Users/aeziz-local/Side Projects/$sumr-token-value-accrual-analysis/results/tables/monitoring_cycles.csv","/Users/aeziz-local/Side Projects/$sumr-token-value-accrual-analysis/results/tables/monitoring_latest.json"],"validation_checks":[{"name":"freeze_baseline_exit_status","status":"pass","details":"`make freeze_baseline` exited 0. Output reported: generated_utc `2026-03-04T21:04:20.001437+00:00`, files hashed `229`, tree SHA256 `7aeb2b56d7bceb3e1b4177cc04f20f9cd8171b5bc537d7c64ab14ee1086c0fbd`, refresh block range `41932733 -> 42706804`."},{"name":"monitor_cycle_exit_status","status":"pass","details":"`python -m src.analysis.monitor_cycle ...` exited 0 and reported append to `results/tables/monitoring_cycles.csv`."},{"name":"monitoring_latest_path_consistency","status":"pass","details":"`results/tables/monitoring_latest.json` contains snapshot_dir `data/snapshots/external_review/2026-03-04-independent-rerun4`, evidence_dir `results/proofs/evidence_2026-03-04-independent-rerun4`, observed_utc `2026-03-04T21:04:29.548860+00:00`."},{"name":"baseline_monitor_provenance_match","status":"pass","details":"Baseline values match across artifacts: `baseline_manifest_latest.generated_utc == monitoring_latest.latest.baseline_manifest_generated_utc == 2026-03-04T21:04:20.001437+00:00`; tree SHA256 matches `7aeb2b56d7bceb3e1b4177cc04f20f9cd8171b5bc537d7c64ab14ee1086c0fbd`."},{"name":"monitoring_latest_row_present","status":"pass","details":"Latest row present in `results/tables/monitoring_cycles.csv` with observed_utc `2026-03-04T21:04:29.548860+00:00`; `open_high_ticket_count=1`."}],"artifacts":["/Users/aeziz-local/Side Projects/$sumr-token-value-accrual-analysis/results/tables/baseline_manifest_20260304T210420Z.json","/Users/aeziz-local/Side Projects/$sumr-token-value-accrual-analysis/results/tables/baseline_manifest_latest.json","/Users/aeziz-local/Side Projects/$sumr-token-value-accrual-analysis/results/tables/monitoring_cycles.csv","/Users/aeziz-local/Side Projects/$sumr-token-value-accrual-analysis/results/tables/monitoring_latest.json"],"blockers":[],"next_actions":["remaining_items: Step 9 (`make report`) and Quality Gates A-E are not executed in this step by boundary.","remaining_items: if preparing publication, explicitly address the current `open_high_ticket_count=1` risk signal in downstream release notes/gates."]}