{"phase":"execution_step","step_id":10,"step_name":"quality_gates","status":"partial","summary":"Executed playbook Section 7 (Gates A-E) for run_tag `2026-03-04-independent-rerun4` from repo root. Gates A-D passed. Gate E publication condition failed: `open_high_ticket_count` is `1` (open HIGH discrepancy in `payout_routing`: \"Funded campaign has no observed reward-token claims\").","commands_run":["python - <<'PY'\nimport json\nfrom pathlib import Path\nRUN_TAG = '2026-03-04-independent-rerun4'\nm = json.loads(Path('results/tables/monitoring_latest.json').read_text())\nprint('snapshot_dir:', m['snapshot_dir'])\nprint('evidence_dir:', m['evidence_dir'])\nprint('observed_utc:', m['latest']['observed_utc'])\nprint('snapshot_matches_run_tag:', str(m['snapshot_dir']).endswith(RUN_TAG))\nprint('evidence_matches_run_tag:', str(m['evidence_dir']).endswith(RUN_TAG))\nPY","python - <<'PY'\nimport json\nfrom pathlib import Path\ns = json.loads(Path('results/tables/scenario_assumptions_latest.json').read_text())\nprint('status:', s.get('status'))\nprint('token_price_pinned:', s['assumptions']['token_price_usd']['pinned'])\nprint('supply_pinned:', s['assumptions']['circulating_supply_tokens']['pinned'])\nPY","python - <<'PY'\nfrom pathlib import Path\nimport json\nm = json.loads(Path('results/tables/monitoring_latest.json').read_text())\ne = Path(m['evidence_dir'])\nrequired = [\n  'kpi_summary.json',\n  'payout_attribution_summary.json',\n  'staker_revenue_canonical_summary.json',\n  'source_of_funds_summary.json',\n  'emissions_vs_revenue_decomposition.json',\n  'discrepancy_tickets.json',\n]\nmissing = [f for f in required if not (e / f).exists()]\nprint('evidence_dir:', e)\nprint('missing:', missing)\nif missing:\n    raise SystemExit(1)\nPY","python - <<'PY'\nfrom pathlib import Path\nt = Path('paper/report.md').read_text(encoding='utf-8')\nassert '<!-- BEGIN AUTO_FACTS -->' in t\nassert '<!-- END AUTO_FACTS -->' in t\nprint('report markers: OK')\nPY","python - <<'PY'\nimport json\nfrom pathlib import Path\nm = json.loads(Path('results/tables/monitoring_latest.json').read_text())\ne = Path(m['evidence_dir'])\nt = json.loads((e / 'discrepancy_tickets.json').read_text())\nprint('ticket_summary:', t.get('summary'))\nprint('open_high_ticket_count:', m['latest'].get('open_high_ticket_count'))\nPY","python - <<'PY'\nimport json\nfrom pathlib import Path\nm = json.loads(Path('results/tables/monitoring_latest.json').read_text())\ne = Path(m['evidence_dir'])\nt = json.loads((e / 'discrepancy_tickets.json').read_text())\nopen_high = [x for x in t.get('tickets', []) if x.get('severity') == 'HIGH' and x.get('status') == 'OPEN']\nprint('open_high_count:', len(open_high))\nfor i, ticket in enumerate(open_high, 1):\n    print(f'open_high_{i}_id:', ticket.get('id'))\n    print(f'open_high_{i}_title:', ticket.get('title'))\n    print(f'open_high_{i}_category:', ticket.get('category'))\nPY","git status --short"],"files_created":[],"files_modified":[],"validation_checks":[{"name":"Gate A: Freshness and path consistency","status":"pass","details":"`results/tables/monitoring_latest.json` points to `data/snapshots/external_review/2026-03-04-independent-rerun4` and `results/proofs/evidence_2026-03-04-independent-rerun4`; `observed_utc=2026-03-04T21:04:29.548860+00:00`."},{"name":"Gate B: Scenario assumptions pinned","status":"pass","details":"`results/tables/scenario_assumptions_latest.json` shows `status=READY_PINNED`, `token_price_pinned=True`, `supply_pinned=True`."},{"name":"Gate C: Evidence core files exist","status":"pass","details":"All required core files were present under `results/proofs/evidence_2026-03-04-independent-rerun4`; `missing=[]`."},{"name":"Gate D: Report sync integrity","status":"pass","details":"`paper/report.md` contains both markers: `<!-- BEGIN AUTO_FACTS -->` and `<!-- END AUTO_FACTS -->`."},{"name":"Gate E: Ticket severity visibility","status":"fail","details":"`ticket_summary={'ticket_count': 5, 'severity_counts': {'HIGH': 1, 'MEDIUM': 2, 'LOW': 2}, 'status_counts': {'OPEN': 3, 'RESOLVED': 2}}`; `open_high_ticket_count=1`."},{"name":"Gate E blocker detail extraction","status":"pass","details":"Open HIGH ticket detail: `title=Funded campaign has no observed reward-token claims`, `category=payout_routing`, `id=None`."}],"artifacts":["/Users/aeziz-local/Side Projects/$sumr-token-value-accrual-analysis/results/tables/monitoring_latest.json","/Users/aeziz-local/Side Projects/$sumr-token-value-accrual-analysis/results/tables/scenario_assumptions_latest.json","/Users/aeziz-local/Side Projects/$sumr-token-value-accrual-analysis/results/proofs/evidence_2026-03-04-independent-rerun4/kpi_summary.json","/Users/aeziz-local/Side Projects/$sumr-token-value-accrual-analysis/results/proofs/evidence_2026-03-04-independent-rerun4/payout_attribution_summary.json","/Users/aeziz-local/Side Projects/$sumr-token-value-accrual-analysis/results/proofs/evidence_2026-03-04-independent-rerun4/staker_revenue_canonical_summary.json","/Users/aeziz-local/Side Projects/$sumr-token-value-accrual-analysis/results/proofs/evidence_2026-03-04-independent-rerun4/source_of_funds_summary.json","/Users/aeziz-local/Side Projects/$sumr-token-value-accrual-analysis/results/proofs/evidence_2026-03-04-independent-rerun4/emissions_vs_revenue_decomposition.json","/Users/aeziz-local/Side Projects/$sumr-token-value-accrual-analysis/results/proofs/evidence_2026-03-04-independent-rerun4/discrepancy_tickets.json","/Users/aeziz-local/Side Projects/$sumr-token-value-accrual-analysis/paper/report.md"],"blockers":["Publication-quality gate is not fully satisfied because `open_high_ticket_count` is 1 (HIGH OPEN discrepancy: \"Funded campaign has no observed reward-token claims\")."],"next_actions":["remaining_items: Resolve or explicitly risk-disclose the open HIGH discrepancy before claiming publication-ready pass on Gate E.","After ticket resolution/update, rerun Gate E check against `results/tables/monitoring_latest.json` and the active evidence dir.","If publishing without resolution, include explicit high-severity risk callout per playbook Section 7 Gate E expectation."]}