{"phase":"execution_step","step_id":5,"step_name":"refresh_claims_and_nav","status":"complete","summary":"Executed only Playbook Step 5 in full mode for run tag `2026-03-04-independent-rerun4`. Both refresh commands succeeded against the assigned snapshot directory and block floor, producing refreshed claim snapshots/receipts/manifest and LVUSDC NAV snapshots for window `41932733 -> 42933895`.","commands_run":["make refresh_claims REFRESH_SNAPSHOT_DIR='data/snapshots/external_review/2026-03-04-independent-rerun4' REFRESH_FROM_BLOCK=41932733","make refresh_lvusdc_nav REFRESH_SNAPSHOT_DIR='data/snapshots/external_review/2026-03-04-independent-rerun4' REFRESH_FROM_BLOCK=41932733","ls -1 'data/snapshots/external_review/2026-03-04-independent-rerun4' | rg '^(base_rpc_distributor_claimed_|base_rpc_receipt_|manifest_claim_refresh_latest\\.json|base_rpc_lvusdc_convertToAssets_)' | sort","python -c \"import json; p=json.load(open('data/snapshots/external_review/2026-03-04-independent-rerun4/manifest_claim_refresh_latest.json')); r=p['runs'][-1]; print('manifest_from_to_count', r['from_block'], r['to_block'], len(r['files']))\"","python -c \"import json; n=json.load(open('data/snapshots/external_review/2026-03-04-independent-rerun4/base_rpc_lvusdc_convertToAssets_latest.json')); print('nav_from_to_snapshots', n['claim_window_from_block'], n['observation_block'], n['snapshot_count'])\"","python -c \"import json; import pathlib as p; s=p.Path('data/snapshots/external_review/2026-03-04-independent-rerun4');\\nfor k in ['usdc','lvusdc','abasusdc']:\\n d=json.load(open(s/f'base_rpc_distributor_claimed_{k}_41932733_latest.json')); print(k, d['count'], d['to_block'])\"","python -c \"from pathlib import Path; s=Path('data/snapshots/external_review/2026-03-04-independent-rerun4'); req=['base_rpc_distributor_claimed_usdc_41932733_latest.json','base_rpc_distributor_claimed_lvusdc_41932733_latest.json','base_rpc_distributor_claimed_abasusdc_41932733_latest.json','base_rpc_receipt_0x5aa10ad32d3d6a3d15d614954dbbe960da2f4376301e28b39b063d485dc15941.json','base_rpc_receipt_0x30643401cafbc331687f312b4fab670470553419ea3c2cef510f48e00c488e54.json','base_rpc_receipt_0xd7cc4ae7ca3f8d3855c7c4d79f7c94745a95b96c0ac883078c1536d08d11616d.json','manifest_claim_refresh_latest.json','base_rpc_lvusdc_convertToAssets_latest.json']; missing=[f for f in req if not (s/f).exists()]; print('missing', missing); raise SystemExit(1 if missing else 0)\"","git status --short"],"files_created":[],"files_modified":["/Users/aeziz-local/Side Projects/$sumr-token-value-accrual-analysis/data/snapshots/external_review/2026-03-04-independent-rerun4/base_rpc_distributor_claimed_usdc_41932733_42933895.json","/Users/aeziz-local/Side Projects/$sumr-token-value-accrual-analysis/data/snapshots/external_review/2026-03-04-independent-rerun4/base_rpc_distributor_claimed_usdc_41932733_latest.json","/Users/aeziz-local/Side Projects/$sumr-token-value-accrual-analysis/data/snapshots/external_review/2026-03-04-independent-rerun4/base_rpc_distributor_claimed_lvusdc_41932733_42933895.json","/Users/aeziz-local/Side Projects/$sumr-token-value-accrual-analysis/data/snapshots/external_review/2026-03-04-independent-rerun4/base_rpc_distributor_claimed_lvusdc_41932733_latest.json","/Users/aeziz-local/Side Projects/$sumr-token-value-accrual-analysis/data/snapshots/external_review/2026-03-04-independent-rerun4/base_rpc_distributor_claimed_abasusdc_41932733_42933895.json","/Users/aeziz-local/Side Projects/$sumr-token-value-accrual-analysis/data/snapshots/external_review/2026-03-04-independent-rerun4/base_rpc_distributor_claimed_abasusdc_41932733_latest.json","/Users/aeziz-local/Side Projects/$sumr-token-value-accrual-analysis/data/snapshots/external_review/2026-03-04-independent-rerun4/base_rpc_receipt_0x5aa10ad32d3d6a3d15d614954dbbe960da2f4376301e28b39b063d485dc15941.json","/Users/aeziz-local/Side Projects/$sumr-token-value-accrual-analysis/data/snapshots/external_review/2026-03-04-independent-rerun4/base_rpc_receipt_0x30643401cafbc331687f312b4fab670470553419ea3c2cef510f48e00c488e54.json","/Users/aeziz-local/Side Projects/$sumr-token-value-accrual-analysis/data/snapshots/external_review/2026-03-04-independent-rerun4/base_rpc_receipt_0xd7cc4ae7ca3f8d3855c7c4d79f7c94745a95b96c0ac883078c1536d08d11616d.json","/Users/aeziz-local/Side Projects/$sumr-token-value-accrual-analysis/data/snapshots/external_review/2026-03-04-independent-rerun4/manifest_claim_refresh_latest.json","/Users/aeziz-local/Side Projects/$sumr-token-value-accrual-analysis/data/snapshots/external_review/2026-03-04-independent-rerun4/base_rpc_lvusdc_convertToAssets_41932733_42933895.json","/Users/aeziz-local/Side Projects/$sumr-token-value-accrual-analysis/data/snapshots/external_review/2026-03-04-independent-rerun4/base_rpc_lvusdc_convertToAssets_41932733_latest.json","/Users/aeziz-local/Side Projects/$sumr-token-value-accrual-analysis/data/snapshots/external_review/2026-03-04-independent-rerun4/base_rpc_lvusdc_convertToAssets_latest.json"],"validation_checks":[{"name":"refresh_claims_target","status":"pass","details":"`make refresh_claims` exited 0; reported `Refreshed claim snapshots for tokens: usdc, lvusdc, abasusdc`, window `41932733 -> 42933895`, `Files written: 9`, and manifest update."},{"name":"refresh_lvusdc_nav_target","status":"pass","details":"`make refresh_lvusdc_nav` exited 0; reported `Blocks queried: 101`, window `41932733 -> 42933895`, `Files written: 3`."},{"name":"required_step5_artifacts_exist","status":"pass","details":"Artifact existence check returned `missing []` for claim latest files, 3 receipts, claim manifest, and NAV latest file."},{"name":"claims_manifest_window","status":"pass","details":"`manifest_claim_refresh_latest.json` latest run shows `from_block=41932733`, `to_block=42933895`, `file_count=9`."},{"name":"nav_window_consistency","status":"pass","details":"`base_rpc_lvusdc_convertToAssets_latest.json` shows `claim_window_from_block=41932733`, `observation_block=42933895`, `snapshot_count=101`."},{"name":"token_claim_counts_loaded","status":"pass","details":"Latest claim payload counts/to-block: `usdc=1338@42933895`, `lvusdc=99@42933895`, `abasusdc=2220@42933895`."},{"name":"workspace_delta_check","status":"pass","details":"`git status --short` shows only pre-existing modified file: `results/proofs/update_runs/2026-03-04-independent-rerun4/execution_steps_20260304T203512Z.tsv`."}],"artifacts":["/Users/aeziz-local/Side Projects/$sumr-token-value-accrual-analysis/data/snapshots/external_review/2026-03-04-independent-rerun4/manifest_claim_refresh_latest.json","/Users/aeziz-local/Side Projects/$sumr-token-value-accrual-analysis/data/snapshots/external_review/2026-03-04-independent-rerun4/base_rpc_distributor_claimed_usdc_41932733_latest.json","/Users/aeziz-local/Side Projects/$sumr-token-value-accrual-analysis/data/snapshots/external_review/2026-03-04-independent-rerun4/base_rpc_distributor_claimed_lvusdc_41932733_latest.json","/Users/aeziz-local/Side Projects/$sumr-token-value-accrual-analysis/data/snapshots/external_review/2026-03-04-independent-rerun4/base_rpc_distributor_claimed_abasusdc_41932733_latest.json","/Users/aeziz-local/Side Projects/$sumr-token-value-accrual-analysis/data/snapshots/external_review/2026-03-04-independent-rerun4/base_rpc_lvusdc_convertToAssets_latest.json"],"blockers":[],"next_actions":["Remaining items (outside this step scope): execute Step 6 (`make evidence`, `make v2_workflow`).","Remaining items (outside this step scope): execute Step 7 scenarios with pinned assumptions.","Remaining items (outside this step scope): execute Steps 8-9 (freeze baseline, monitor cycle, report), then run Gates A-E."]}