{"phase":"execution_step","step_id":9,"step_name":"report_generation","status":"complete","summary":"Executed Step 9 report generation from repo root. Ran `make report` to regenerate report + investor outputs, then ran optional `make investor_pdf`. Final stabilization pass completed with consistent investor snapshot pointers (`investor_extended_summary.json` and `data/snapshots/investor_external/latest_manifest.json` both point to `20260304T211814Z`).","commands_run":["pwd","make report","MPLCONFIGDIR='/tmp/matplotlib' XDG_CACHE_HOME='/tmp/.cache' make report","MPLCONFIGDIR='/tmp/matplotlib' XDG_CACHE_HOME='/tmp/.cache' make report","MPLCONFIGDIR='/tmp/matplotlib' XDG_CACHE_HOME='/tmp/.cache' make investor_pdf","python - <<'PY'\nfrom pathlib import Path\ntext = Path('paper/report.md').read_text(encoding='utf-8')\nprint('has_begin_marker', '<!-- BEGIN AUTO_FACTS -->' in text)\nprint('has_end_marker', '<!-- END AUTO_FACTS -->' in text)\nPY","python - <<'PY'\nimport json\nfrom pathlib import Path\nsummary = json.loads(Path('results/tables/investor_extended_summary.json').read_text())\nmanifest = json.loads(Path('data/snapshots/investor_external/latest_manifest.json').read_text())\nprint('summary_snapshot_dir', summary.get('snapshot_dir'))\nprint('latest_manifest_snapshot_dir', manifest.get('latest_snapshot_dir'))\nprint('consistent', summary.get('snapshot_dir') == manifest.get('latest_snapshot_dir'))\nPY","ls -lt 'paper/report.md' 'paper/comprehensive_value_accrual_report.md' 'paper/investor_executive_summary.md' 'paper/investor_executive_summary.tex' 'paper/investor_executive_summary.pdf' 'results/tables/investor_extended_summary.json' 'results/tables/investor_staking_distribution.json' 'results/charts/investor_staking_lockup_distribution.png'","git status --short --untracked-files=all"],"files_created":["data/snapshots/investor_external/20260304T211814Z/manifest.json","results/tables/investor_price_context_refresh_20260304T211814Z.json","results/tables/investor_price_context_refresh_20260304T211814Z.csv","results/tables/investor_probability_weighted_pnl_price_refresh_20260304T211814Z.json","results/tables/investor_probability_weighted_pnl_price_refresh_20260304T211814Z.csv","results/tables/investor_upside_plausibility_indicators_20260304T211814Z.json","results/tables/investor_upside_plausibility_indicators_20260304T211814Z.csv","results/tables/investor_verified_vs_external_reconciliation_20260304T211814Z.json","results/tables/investor_verified_vs_external_reconciliation_20260304T211814Z.csv"],"files_modified":["paper/report.md","paper/comprehensive_value_accrual_report.md","paper/investor_executive_summary.md","paper/investor_executive_summary.tex","paper/investor_executive_summary.pdf","results/tables/investor_extended_summary.json","results/tables/investor_staking_distribution.json","results/charts/investor_staking_lockup_distribution.png","results/proofs/update_runs/2026-03-04-independent-rerun4/execution_steps_20260304T203512Z.tsv"],"validation_checks":[{"name":"make_report_completed","status":"pass","details":"`make report` completed successfully; output included `Wrote comprehensive report ...`, `Wrote extended investor artifacts ...`, `Wrote investor executive summary ...`, and `Wrote LaTeX report ...`."},{"name":"optional_investor_pdf_completed","status":"pass","details":"`make investor_pdf` completed successfully; XeLaTeX compiled `paper/investor_executive_summary.pdf` (13 pages)."},{"name":"report_auto_fact_markers","status":"pass","details":"`paper/report.md` contains both `<!-- BEGIN AUTO_FACTS -->` and `<!-- END AUTO_FACTS -->` markers."},{"name":"investor_snapshot_pointer_consistency","status":"pass","details":"`results/tables/investor_extended_summary.json` snapshot_dir equals `data/snapshots/investor_external/latest_manifest.json` latest_snapshot_dir (`.../20260304T211814Z`)."},{"name":"workspace_diff_check","status":"pass","details":"Tracked modified files after Step 9: paper/comprehensive_value_accrual_report.md, paper/investor_executive_summary.md, paper/report.md, results/proofs/update_runs/2026-03-04-independent-rerun4/execution_steps_20260304T203512Z.tsv."}],"artifacts":["paper/report.md","paper/comprehensive_value_accrual_report.md","paper/investor_executive_summary.md","paper/investor_executive_summary.tex","paper/investor_executive_summary.pdf","results/tables/investor_extended_summary.json","results/tables/investor_staking_distribution.json","results/charts/investor_staking_lockup_distribution.png","data/snapshots/investor_external/20260304T211814Z/manifest.json","data/snapshots/investor_external/latest_manifest.json"],"blockers":[],"next_actions":["remaining_items: none (Step 9 scope complete, including optional investor PDF build)."]}