{"phase":"execution_step","step_id":3,"step_name":"refresh_forum_and_transactions","status":"complete","summary":"Completed playbook Step 3 for run tag `2026-03-04-independent-rerun4` by refreshing all assigned forum and transaction snapshots into `data/snapshots/external_review/2026-03-04-independent-rerun4`. Performed high-signal integrity checks: all files are non-empty valid JSON; forum payloads contain `post_stream`; transaction payloads contain `hash` matching expected tx ids. No blockers encountered.","commands_run":["set -euo pipefail; pwd; export SNAPSHOT_DIR='data/snapshots/external_review/2026-03-04-independent-rerun4'; python - <<'PY' ... requests.get(...) write summer_forum_sip3_13.json, summer_forum_sip3_13_1.json, tx_0x5aa10ad32d3d6a3d15d614954dbbe960da2f4376301e28b39b063d485dc15941.json, tx_0x30643401cafbc331687f312b4fab670470553419ea3c2cef510f48e00c488e54.json, tx_0xd7cc4ae7ca3f8d3855c7c4d79f7c94745a95b96c0ac883078c1536d08d11616d.json","set -euo pipefail; ls -l 'data/snapshots/external_review/2026-03-04-independent-rerun4'/summer_forum_sip3_13.json 'data/snapshots/external_review/2026-03-04-independent-rerun4'/summer_forum_sip3_13_1.json 'data/snapshots/external_review/2026-03-04-independent-rerun4'/tx_0x5aa10ad32d3d6a3d15d614954dbbe960da2f4376301e28b39b063d485dc15941.json 'data/snapshots/external_review/2026-03-04-independent-rerun4'/tx_0x30643401cafbc331687f312b4fab670470553419ea3c2cef510f48e00c488e54.json 'data/snapshots/external_review/2026-03-04-independent-rerun4'/tx_0xd7cc4ae7ca3f8d3855c7c4d79f7c94745a95b96c0ac883078c1536d08d11616d.json","set -euo pipefail; python - <<'PY' ... json/sha256 validation for all 5 files, key checks (`post_stream` for forum, `hash` for tx)","set -euo pipefail; git status --short -- 'data/snapshots/external_review/2026-03-04-independent-rerun4'"],"files_created":[],"files_modified":["data/snapshots/external_review/2026-03-04-independent-rerun4/summer_forum_sip3_13.json","data/snapshots/external_review/2026-03-04-independent-rerun4/summer_forum_sip3_13_1.json","data/snapshots/external_review/2026-03-04-independent-rerun4/tx_0x5aa10ad32d3d6a3d15d614954dbbe960da2f4376301e28b39b063d485dc15941.json","data/snapshots/external_review/2026-03-04-independent-rerun4/tx_0x30643401cafbc331687f312b4fab670470553419ea3c2cef510f48e00c488e54.json","data/snapshots/external_review/2026-03-04-independent-rerun4/tx_0xd7cc4ae7ca3f8d3855c7c4d79f7c94745a95b96c0ac883078c1536d08d11616d.json"],"validation_checks":[{"name":"target_fetch_write","status":"pass","details":"All 5 target URLs fetched successfully and written to the assigned snapshot directory."},{"name":"json_integrity_and_shape","status":"pass","details":"All 5 files parse as JSON, are non-empty, and include expected keys (`post_stream` for forum files, `hash` for tx files)."},{"name":"transaction_id_consistency","status":"pass","details":"Each tx JSON `hash` value matches its filename tx hash."},{"name":"artifact_presence_size","status":"pass","details":"`ls -l` confirms all 5 artifacts exist with non-zero sizes in the run snapshot directory."},{"name":"scope_boundary","status":"pass","details":"Executed only Step 3 refresh and Step 3-specific verification commands; no Step 4+ pipeline execution performed."}],"artifacts":["data/snapshots/external_review/2026-03-04-independent-rerun4/summer_forum_sip3_13.json (sha256=ecc560607839d790e67686f32b29ea424ca78a5e037ad2d355762b56acc4f73b)","data/snapshots/external_review/2026-03-04-independent-rerun4/summer_forum_sip3_13_1.json (sha256=d7a2f1bfe2840615c6f32bace83021f76fa4733fdf11e9db03dbe6e7a05d349f)","data/snapshots/external_review/2026-03-04-independent-rerun4/tx_0x5aa10ad32d3d6a3d15d614954dbbe960da2f4376301e28b39b063d485dc15941.json (sha256=32c612bced25053671190f73516a3b0892df9fa4e27b5fb18c14a4457bda8609)","data/snapshots/external_review/2026-03-04-independent-rerun4/tx_0x30643401cafbc331687f312b4fab670470553419ea3c2cef510f48e00c488e54.json (sha256=5db5d59e2e454bb4665007f4ad90aed608a6ae1e8ddff6295a5a35ce1c3b46ae)","data/snapshots/external_review/2026-03-04-independent-rerun4/tx_0xd7cc4ae7ca3f8d3855c7c4d79f7c94745a95b96c0ac883078c1536d08d11616d.json (sha256=3abb9d7b3b72145049a4d241fb036cd19d7ee6f002f1522bf385b46ade3f0071)"],"blockers":[],"next_actions":["remaining_items: none within assigned Step 3 tracked-file scope.","If new SIP payout cycles are identified in this round, add corresponding forum/tx snapshots and update campaign constants before downstream analysis (out of scope for Step 3 execution boundary)."]}