{"phase":"execution_step","step_id":0,"step_name":"setup_context","status":"complete","summary":"Completed Step 0 only for run tag `2026-03-04-independent-rerun4`: created required run directories and seeded `data/snapshots/external_review/2026-03-04-independent-rerun4` from `data/snapshots/external_review/2026-03-04-independent` via rsync. Verified directory existence and source/target snapshot parity (file count, byte total, filename set). No future playbook steps were executed.","commands_run":["pwd && ls -la","ls -ld 'data/snapshots/external_review/2026-03-04-independent' 'data/snapshots/external_review/2026-03-04-independent-rerun4' 2>/dev/null || true","export RUN_TAG='2026-03-04-independent-rerun4'\nexport SNAPSHOT_DIR='data/snapshots/external_review/2026-03-04-independent-rerun4'\nexport EVIDENCE_DIR='results/proofs/evidence_2026-03-04-independent-rerun4'\nexport TABLES_DIR='results/tables'\nexport CHARTS_DIR='results/charts'\nexport PREV_SNAPSHOT_DIR='data/snapshots/external_review/2026-03-04-independent'\nmkdir -p \"$SNAPSHOT_DIR\" \"$EVIDENCE_DIR\" \"$TABLES_DIR\" \"$CHARTS_DIR\"\nrsync -a \"$PREV_SNAPSHOT_DIR/\" \"$SNAPSHOT_DIR/\"","echo '--- required directories ---'\nfor d in \\\n  'data/snapshots/external_review/2026-03-04-independent-rerun4' \\\n  'results/proofs/evidence_2026-03-04-independent-rerun4' \\\n  'results/tables' \\\n  'results/charts'\ndo\n  if [ -d \"$d\" ]; then\n    echo \"OK $d\"\n  else\n    echo \"MISSING $d\"\n  fi\ndone\n\necho '--- snapshot file counts ---'\nprev_count=$(find 'data/snapshots/external_review/2026-03-04-independent' -type f | wc -l | tr -d ' ')\nnew_count=$(find 'data/snapshots/external_review/2026-03-04-independent-rerun4' -type f | wc -l | tr -d ' ')\necho \"prev_count=$prev_count\"\necho \"new_count=$new_count\"\n\necho '--- snapshot byte totals ---'\nprev_bytes=$(find 'data/snapshots/external_review/2026-03-04-independent' -type f -exec wc -c {} + | tail -n 1 | awk '{print $1}')\nnew_bytes=$(find 'data/snapshots/external_review/2026-03-04-independent-rerun4' -type f -exec wc -c {} + | tail -n 1 | awk '{print $1}')\necho \"prev_bytes=$prev_bytes\"\necho \"new_bytes=$new_bytes\"\n\necho '--- sample seeded files ---'\nfind 'data/snapshots/external_review/2026-03-04-independent-rerun4' -maxdepth 1 -type f | sed \"s#^#- #\" | head -n 12","git status --short","tmp_prev=$(mktemp)\ntmp_new=$(mktemp)\nfind 'data/snapshots/external_review/2026-03-04-independent' -maxdepth 1 -type f -print | sed \"s#data/snapshots/external_review/2026-03-04-independent/##\" | sort > \"$tmp_prev\"\nfind 'data/snapshots/external_review/2026-03-04-independent-rerun4' -maxdepth 1 -type f -print | sed \"s#data/snapshots/external_review/2026-03-04-independent-rerun4/##\" | sort > \"$tmp_new\"\necho 'missing_in_new:'\ncomm -23 \"$tmp_prev\" \"$tmp_new\" || true\necho 'extra_in_new:'\ncomm -13 \"$tmp_prev\" \"$tmp_new\" || true\nrm -f \"$tmp_prev\" \"$tmp_new\"","ls -ld 'results/proofs/evidence_2026-03-04-independent-rerun4' && find 'results/proofs/evidence_2026-03-04-independent-rerun4' -maxdepth 1 -type f | wc -l","find 'data/snapshots/external_review/2026-03-04-independent-rerun4' -maxdepth 1 -type f | sort"],"files_created":["data/snapshots/external_review/2026-03-04-independent-rerun4","results/proofs/evidence_2026-03-04-independent-rerun4","data/snapshots/external_review/2026-03-04-independent-rerun4/arb_blockscout_tipjar_txs_all.json","data/snapshots/external_review/2026-03-04-independent-rerun4/base_blockscout_foundation_tipstream_token_transfers_all.json","data/snapshots/external_review/2026-03-04-independent-rerun4/base_blockscout_grm_rewardAdded_all.json","data/snapshots/external_review/2026-03-04-independent-rerun4/base_blockscout_stsumr_contract.json","data/snapshots/external_review/2026-03-04-independent-rerun4/base_blockscout_summerstaking_contract.json","data/snapshots/external_review/2026-03-04-independent-rerun4/base_blockscout_tipjar_txs_all.json","data/snapshots/external_review/2026-03-04-independent-rerun4/base_blockscout_treasury_token_transfers_all.json","data/snapshots/external_review/2026-03-04-independent-rerun4/base_rpc_supply_and_receipts.json","data/snapshots/external_review/2026-03-04-independent-rerun4/defillama_fees_dailyFees_lazy_summer.json","data/snapshots/external_review/2026-03-04-independent-rerun4/defillama_fees_dailyRevenue_lazy_summer.json","data/snapshots/external_review/2026-03-04-independent-rerun4/defillama_protocol_lazy_summer.json","data/snapshots/external_review/2026-03-04-independent-rerun4/defillama_protocol_summer_fi.json","data/snapshots/external_review/2026-03-04-independent-rerun4/eth_blockscout_tipjar_txs_all.json","data/snapshots/external_review/2026-03-04-independent-rerun4/eth_blockscout_treasury_token_transfers_all.json","data/snapshots/external_review/2026-03-04-independent-rerun4/manifest.json","data/snapshots/external_review/2026-03-04-independent-rerun4/summer_forum_sip3_13.json","data/snapshots/external_review/2026-03-04-independent-rerun4/summer_forum_sip3_13_1.json","data/snapshots/external_review/2026-03-04-independent-rerun4/tx_0x30643401cafbc331687f312b4fab670470553419ea3c2cef510f48e00c488e54.json","data/snapshots/external_review/2026-03-04-independent-rerun4/tx_0x5aa10ad32d3d6a3d15d614954dbbe960da2f4376301e28b39b063d485dc15941.json","data/snapshots/external_review/2026-03-04-independent-rerun4/tx_0xd7cc4ae7ca3f8d3855c7c4d79f7c94745a95b96c0ac883078c1536d08d11616d.json"],"files_modified":[],"validation_checks":[{"name":"Required run directories created","status":"pass","details":"Confirmed existing directories: data/snapshots/external_review/2026-03-04-independent-rerun4, results/proofs/evidence_2026-03-04-independent-rerun4, results/tables, results/charts."},{"name":"Seed copy parity: file counts","status":"pass","details":"`find ... -type f | wc -l` returned prev_count=20 and new_count=20."},{"name":"Seed copy parity: byte totals","status":"pass","details":"`wc -c` aggregate totals matched: prev_bytes=6479238 and new_bytes=6479238."},{"name":"Seed copy parity: filename set","status":"pass","details":"`comm` comparison reported no `missing_in_new` and no `extra_in_new` files."},{"name":"Evidence directory initialized","status":"pass","details":"`results/proofs/evidence_2026-03-04-independent-rerun4` exists and currently contains 0 files, consistent with Step 0 setup."}],"artifacts":["data/snapshots/external_review/2026-03-04-independent-rerun4","results/proofs/evidence_2026-03-04-independent-rerun4","results/tables","results/charts"],"blockers":[],"next_actions":["remaining_items: none within assigned Step 0 scope.","out_of_scope_pending: execute Step 1+ (refresh dynamic sources and rebuild downstream artifacts) in subsequent assigned steps only."]}