{"phase":"execution_step","step_id":4,"step_name":"refresh_supply_and_manifest","status":"complete","summary":"Completed assigned Step 4 and Step 4b for run tag `2026-03-04-independent-rerun4` only. Refreshed `base_rpc_supply_and_receipts.json` from `https://base.drpc.org` at block `42933838`, then regenerated `manifest.json` with 19 source entries. Verified manifest includes the supply snapshot entry and matching SHA-256/byte size provenance.","commands_run":["pwd","ls -la 'data/snapshots/external_review'","export SNAPSHOT_DIR='data/snapshots/external_review/2026-03-04-independent-rerun4'; export BASE_RPC_URL='https://base.drpc.org'; python - <<'PY' ... (playbook Step 4 script executed exactly to write base_rpc_supply_and_receipts.json)","export SNAPSHOT_DIR='data/snapshots/external_review/2026-03-04-independent-rerun4'; python - <<'PY' ... (playbook Step 4b script executed exactly to write manifest.json)","python - <<'PY' ... (verification script: existence, key fields, manifest entry presence, SHA/bytes match for base_rpc_supply_and_receipts.json)","git status --short -- 'data/snapshots/external_review/2026-03-04-independent-rerun4/base_rpc_supply_and_receipts.json' 'data/snapshots/external_review/2026-03-04-independent-rerun4/manifest.json'","git check-ignore -v 'data/snapshots/external_review/2026-03-04-independent-rerun4/base_rpc_supply_and_receipts.json' 'data/snapshots/external_review/2026-03-04-independent-rerun4/manifest.json'"],"files_created":[],"files_modified":["/Users/aeziz-local/Side Projects/$sumr-token-value-accrual-analysis/data/snapshots/external_review/2026-03-04-independent-rerun4/base_rpc_supply_and_receipts.json","/Users/aeziz-local/Side Projects/$sumr-token-value-accrual-analysis/data/snapshots/external_review/2026-03-04-independent-rerun4/manifest.json"],"validation_checks":[{"name":"step4_supply_snapshot_write","status":"pass","details":"Script exited 0; wrote snapshot file with `retrieved_utc=2026-03-04T20:43:45.405368Z`, `latest_block=42933838`, `decimals=18`, `totalSupply_raw=977149629405695000000000000`, `cap_raw=1000000000000000000000000000`."},{"name":"step4b_manifest_regeneration","status":"pass","details":"Script exited 0; wrote manifest with `as_of_utc=2026-03-04T20:44:07.590969Z` and `entries=19`."},{"name":"manifest_supply_provenance_integrity","status":"pass","details":"`manifest.json` contains `base_rpc_supply_and_receipts.json` entry with `source_url=BASE_RPC_URL`; SHA-256 and byte size both match file on disk."},{"name":"git_tracking_context","status":"pass","details":"Both updated files are under `data/snapshots/**` and are gitignored by `.gitignore:19`; no tracked-file diff surfaced for these paths."}],"artifacts":["/Users/aeziz-local/Side Projects/$sumr-token-value-accrual-analysis/data/snapshots/external_review/2026-03-04-independent-rerun4/base_rpc_supply_and_receipts.json","/Users/aeziz-local/Side Projects/$sumr-token-value-accrual-analysis/data/snapshots/external_review/2026-03-04-independent-rerun4/manifest.json"],"blockers":[],"next_actions":["remaining_items: Steps 5+ (claims/NAV refresh, evidence rebuild, workflow, scenarios, monitoring, report, and gates) are intentionally not executed in this step assignment.","remaining_items: publication QA gates A-E remain pending until downstream steps complete."]}