{"phase":"execution_step","step_id":1,"step_name":"refresh_defillama","status":"complete","summary":"Step 1 completed in full scope: refreshed the 4 required DeFiLlama files into the assigned snapshot directory and ran `make snapshot` to refresh the timestamped notebook lane. Verified required files exist, parse as JSON, and recorded integrity metadata.","commands_run":["pwd","rg -n \"^snapshot:|snapshot\" Makefile","sed -n '1,80p' Makefile","rg -n \"step.?1|refresh_defillama|SNAPSHOT_DIR|seed_previous_snapshot\" automation -S","sed -n '700,790p' automation/run_update_cycle_execution.sh","export SNAPSHOT_DIR='data/snapshots/external_review/2026-03-04-independent-rerun4'; python - <<'PY' ... requests.get(...) for 4 DeFiLlama targets ... PY","make snapshot","python - <<'PY' ... verify required files exist/parse + list latest timestamped lane files ... PY","python - <<'PY' ... compute sha256/bytes/mtime_utc for 4 required files ... PY","git status --short -- '<step-1-artifact-paths>'"],"files_created":["/Users/aeziz-local/Side Projects/$sumr-token-value-accrual-analysis/data/snapshots/defillama/lazy-summer-protocol_tvl_20260304T203756Z.json","/Users/aeziz-local/Side Projects/$sumr-token-value-accrual-analysis/data/snapshots/defillama/summer.fi_tvl_20260304T203756Z.json","/Users/aeziz-local/Side Projects/$sumr-token-value-accrual-analysis/data/snapshots/defillama/lazy-summer-protocol_fees_20260304T203757Z.json"],"files_modified":["/Users/aeziz-local/Side Projects/$sumr-token-value-accrual-analysis/data/snapshots/external_review/2026-03-04-independent-rerun4/defillama_protocol_lazy_summer.json","/Users/aeziz-local/Side Projects/$sumr-token-value-accrual-analysis/data/snapshots/external_review/2026-03-04-independent-rerun4/defillama_protocol_summer_fi.json","/Users/aeziz-local/Side Projects/$sumr-token-value-accrual-analysis/data/snapshots/external_review/2026-03-04-independent-rerun4/defillama_fees_dailyFees_lazy_summer.json","/Users/aeziz-local/Side Projects/$sumr-token-value-accrual-analysis/data/snapshots/external_review/2026-03-04-independent-rerun4/defillama_fees_dailyRevenue_lazy_summer.json"],"validation_checks":[{"name":"required_defillama_files_present_and_json_parseable","status":"pass","details":"All 4 required files exist in `data/snapshots/external_review/2026-03-04-independent-rerun4` and parse as top-level JSON objects."},{"name":"timestamped_notebook_lane_refreshed","status":"pass","details":"`make snapshot` succeeded and generated new timestamped files in `data/snapshots/defillama` with UTC tags `20260304T203756Z`/`20260304T203757Z`."},{"name":"integrity_metadata_captured","status":"pass","details":"Computed SHA-256, byte size, and UTC mtime for all 4 required files; values listed in artifacts."}],"artifacts":["/Users/aeziz-local/Side Projects/$sumr-token-value-accrual-analysis/data/snapshots/external_review/2026-03-04-independent-rerun4/defillama_protocol_lazy_summer.json sha256=476f51cce2d9e6a731823724774568c73c829a38a9e44cd37674acd2c01285d1 bytes=833894 mtime_utc=2026-03-04T20:37:46.377626+00:00","/Users/aeziz-local/Side Projects/$sumr-token-value-accrual-analysis/data/snapshots/external_review/2026-03-04-independent-rerun4/defillama_protocol_summer_fi.json sha256=fdf328a7b2639ce83385be88400fbb77ead2d8779794450456515e478ded0586 bytes=1604600 mtime_utc=2026-03-04T20:37:47.426032+00:00","/Users/aeziz-local/Side Projects/$sumr-token-value-accrual-analysis/data/snapshots/external_review/2026-03-04-independent-rerun4/defillama_fees_dailyFees_lazy_summer.json sha256=64058abe15e79200debd70ee443a73e7936e001e1a19c97053819418d24f6c9f bytes=150353 mtime_utc=2026-03-04T20:37:48.067095+00:00","/Users/aeziz-local/Side Projects/$sumr-token-value-accrual-analysis/data/snapshots/external_review/2026-03-04-independent-rerun4/defillama_fees_dailyRevenue_lazy_summer.json sha256=7ca3b8906d11ec2157adf48e202da91bfa6266d87e30ff67a07c6ecbf3264627 bytes=148950 mtime_utc=2026-03-04T20:37:48.767449+00:00"],"blockers":[],"next_actions":["remaining_items: none within assigned Step 1 scope; future numbered steps were not executed by design."]}